filename,content
CSUIP France_ ESSCA School of Management,https://abroad.calpoly.edu/index.cfm?FuseAction=Programs.ViewProgram&Program_ID=11206
CSUIP Taiwan_ National Taiwan University,https://abroad.calpoly.edu/index.cfm?FuseAction=Programs.ViewProgram&Program_ID=10283
Cal Poly Exchange with Hochschule München University of Applied Sciences (Munich) - GRAPHIC COMMUNIC,https://abroad.calpoly.edu/index.cfm?FuseAction=Programs.ViewProgram&Program_ID=10018
"Cal Poly Exchange with KTH Royal Institute of Technology, Stockholm (CENG)",https://abroad.calpoly.edu/index.cfm?FuseAction=Programs.ViewProgram&Program_ID=10016
CSUIP Japan_ University of Tsukuba,https://abroad.calpoly.edu/index.cfm?FuseAction=Programs.ViewProgram&Program_ID=10268
CSUIP United Kingdom_ Swansea University,https://abroad.calpoly.edu/index.cfm?FuseAction=Programs.ViewProgram&Program_ID=10555
First Year GO (Global Opportunities) Program,https://abroad.calpoly.edu/index.cfm?FuseAction=Programs.ViewProgram&Program_ID=11302
Cal Poly Global Program_ Cal Poly in Japan_ Architecture (Fall),https://abroad.calpoly.edu/index.cfm?FuseAction=Programs.ViewProgram&Program_ID=11242
CSUIP Spain_ Universidad de Granada,https://abroad.calpoly.edu/index.cfm?FuseAction=Programs.ViewProgram&Program_ID=10276
CSUIP Chile_ Pontificia Universidad Catolica de Chile,https://abroad.calpoly.edu/index.cfm?FuseAction=Programs.ViewProgram&Program_ID=10245
CSUIP Germany_ Biberach University of Applied Sciences,https://abroad.calpoly.edu/index.cfm?FuseAction=Programs.ViewProgram&Program_ID=10252
CSUIP Germany_ Reutlingen University,https://abroad.calpoly.edu/index.cfm?FuseAction=Programs.ViewProgram&Program_ID=10253
CSUIP Italy_ CSU Florence Center,https://abroad.calpoly.edu/index.cfm?FuseAction=Programs.ViewProgram&Program_ID=10267
CSUIP Germany_ Ludwigsburg University of Education,https://abroad.calpoly.edu/index.cfm?FuseAction=Programs.ViewProgram&Program_ID=11209
Cal Poly Exchange with Rikkyo University (LIBERAL ARTS),https://abroad.calpoly.edu/index.cfm?FuseAction=Programs.ViewProgram&Program_ID=10901
CSUIP Germany_ Heidelberg University,https://abroad.calpoly.edu/index.cfm?FuseAction=Programs.ViewProgram&Program_ID=10967
"CSUIP Mexico_ Culture, Politics & Place (Summer)",https://abroad.calpoly.edu/index.cfm?FuseAction=Programs.ViewProgram&Program_ID=11406
CSUIP Germany_ Nuertingen-Geislingen University,https://abroad.calpoly.edu/index.cfm?FuseAction=Programs.ViewProgram&Program_ID=10255
Cal Poly Exchange with Hochschule München University of Applied Sciences (Munich) - BUSINESS,https://abroad.calpoly.edu/index.cfm?FuseAction=Programs.ViewProgram&Program_ID=10782
Cal Poly Global Program_ Cal Poly in Italy_ Health & Culture (Summer),https://abroad.calpoly.edu/index.cfm?FuseAction=Programs.ViewProgram&Program_ID=11198
CSUIP Germany_ University of Hohenheim,https://abroad.calpoly.edu/index.cfm?FuseAction=Programs.ViewProgram&Program_ID=11213
Cal Poly Global Program_ Cal Poly in Taiwan_ Sustainability (Summer),https://abroad.calpoly.edu/index.cfm?FuseAction=Programs.ViewProgram&Program_ID=10893
Cal Poly Exchange with Lucerne University of Applied Sciences (ARCHITECTURE),https://abroad.calpoly.edu/index.cfm?FuseAction=Programs.ViewProgram&Program_ID=10732
Cal Poly Exchange with Hochschule München University of Applied Sciences (Munich) - MATH AND PHYSICS,https://abroad.calpoly.edu/index.cfm?FuseAction=Programs.ViewProgram&Program_ID=10849
CSUIP Canada_ Concordia University,https://abroad.calpoly.edu/index.cfm?FuseAction=Programs.ViewProgram&Program_ID=10244
"Cal Poly Global Program_ Cal Poly in Alicante_ Artificial Intelligence, Language & Culture (Summer)",https://abroad.calpoly.edu/index.cfm?FuseAction=Programs.ViewProgram&Program_ID=11315
CSUIP Germany_ Trossingen University of Music,https://abroad.calpoly.edu/index.cfm?FuseAction=Programs.ViewProgram&Program_ID=10257
CSUIP Germany_ Language & Culture at University of Tübingen,https://abroad.calpoly.edu/index.cfm?FuseAction=Programs.ViewProgram&Program_ID=10256
Cal Poly Global Program_ Cal Poly in Australia_ Campuswide (Winter),https://abroad.calpoly.edu/index.cfm?FuseAction=Programs.ViewProgram&Program_ID=10872
CSUIP Italy_ Accademia di Belle Arti di Firenze,https://abroad.calpoly.edu/index.cfm?FuseAction=Programs.ViewProgram&Program_ID=10266
CSUIP United Kingdom_ University of Hull,https://abroad.calpoly.edu/index.cfm?FuseAction=Programs.ViewProgram&Program_ID=10558
Cal Poly Exchange with Stockholm School of Economics (OCOB),https://abroad.calpoly.edu/index.cfm?FuseAction=Programs.ViewProgram&Program_ID=10870
CSUIP Germany_ University of Tübingen,https://abroad.calpoly.edu/index.cfm?FuseAction=Programs.ViewProgram&Program_ID=11214
CSUIP South Korea_ Korea University,https://abroad.calpoly.edu/index.cfm?FuseAction=Programs.ViewProgram&Program_ID=11202
CSUIP Germany_ Ulm University of Applied Sciences,https://abroad.calpoly.edu/index.cfm?FuseAction=Programs.ViewProgram&Program_ID=11211
CSUIP South Africa_ Nelson Mandela University,https://abroad.calpoly.edu/index.cfm?FuseAction=Programs.ViewProgram&Program_ID=10275
CSUIP United Kingdom_ University of Bristol,https://abroad.calpoly.edu/index.cfm?FuseAction=Programs.ViewProgram&Program_ID=10557
CSUIP Germany_ Stuttgart State Academy of Art and Design,https://abroad.calpoly.edu/index.cfm?FuseAction=Programs.ViewProgram&Program_ID=11218
"Cal Poly Exchange with Swinburne University of Technology, Australia (CENG)",https://abroad.calpoly.edu/index.cfm?FuseAction=Programs.ViewProgram&Program_ID=10011
Cal Poly Global Program_ Cal Poly in Spain_ Campuswide (Fall),https://abroad.calpoly.edu/index.cfm?FuseAction=Programs.ViewProgram&Program_ID=10894
CSUIP Germany_ University of Freiburg,https://abroad.calpoly.edu/index.cfm?FuseAction=Programs.ViewProgram&Program_ID=11212
Cal Poly Global Program_ Cal Poly in Costa Rica_ Agriculture & Conservation (Summer),https://abroad.calpoly.edu/index.cfm?FuseAction=Programs.ViewProgram&Program_ID=10895
CSUIP Germany_ University of Ulm,https://abroad.calpoly.edu/index.cfm?FuseAction=Programs.ViewProgram&Program_ID=11215
Cal Poly Global Program_ Cal Poly in Peru_ Campuswide (Spring),https://abroad.calpoly.edu/index.cfm?FuseAction=Programs.ViewProgram&Program_ID=10885
CSUIP Germany_ Ravensburg-Weingarten University of Applied Sciences,https://abroad.calpoly.edu/index.cfm?FuseAction=Programs.ViewProgram&Program_ID=11210
Cal Poly Global Program_ Cal Poly in Rome_ Software Engineering (Fall),https://abroad.calpoly.edu/index.cfm?FuseAction=Programs.ViewProgram&Program_ID=10832
Cal Poly Global Program_ Cal Poly in Brazil_ Business (Fall Course + Winter Break trip),https://abroad.calpoly.edu/index.cfm?FuseAction=Programs.ViewProgram&Program_ID=10888
Cal Poly Global Program_ Cal Poly in Panama_ Sustainability (Spring Break),https://abroad.calpoly.edu/index.cfm?FuseAction=Programs.ViewProgram&Program_ID=10897
Cal Poly Global Program_ Cal Poly in Spain_ Campuswide (Summer),https://abroad.calpoly.edu/index.cfm?FuseAction=Programs.ViewProgram&Program_ID=10890
Cal Poly Global Program_ Cal Poly in Lithuania_ Architectural Engineering (Summer),https://abroad.calpoly.edu/index.cfm?FuseAction=Programs.ViewProgram&Program_ID=10905
Cal Poly Exchange with Hochschule München University of Applied Sciences (Munich) - ENGINEERING,https://abroad.calpoly.edu/index.cfm?FuseAction=Programs.ViewProgram&Program_ID=10013
Cal Poly Global Program_ Cal Poly in Japan_ Architecture (Spring),https://abroad.calpoly.edu/index.cfm?FuseAction=Programs.ViewProgram&Program_ID=10909
CSUIP France_ Language & Culture at Aix-Marseille Université,https://abroad.calpoly.edu/index.cfm?FuseAction=Programs.ViewProgram&Program_ID=10250
CSUIP Germany_ Freiburg University of Education,https://abroad.calpoly.edu/index.cfm?FuseAction=Programs.ViewProgram&Program_ID=11207
CSUIP Germany_ University of Stuttgart (Architecture),https://abroad.calpoly.edu/index.cfm?FuseAction=Programs.ViewProgram&Program_ID=11219
CSUIP France_ Universities of Paris,https://abroad.calpoly.edu/index.cfm?FuseAction=Programs.ViewProgram&Program_ID=10251
CSUIP Sweden_ Uppsala University,https://abroad.calpoly.edu/index.cfm?FuseAction=Programs.ViewProgram&Program_ID=10281
CSUIP Mexico_ Tecnológico de Monterrey,https://abroad.calpoly.edu/index.cfm?FuseAction=Programs.ViewProgram&Program_ID=11216
Cal Poly in South Korea_ Architecture (Spring),https://abroad.calpoly.edu/index.cfm?FuseAction=Programs.ViewProgram&Program_ID=11093
"Cal Poly Exchange with Stuttgart Media University, Germany (CLA)",https://abroad.calpoly.edu/index.cfm?FuseAction=Programs.ViewProgram&Program_ID=10001
Cal Poly Global Program_ Cal Poly in Europe_ Wine & Viticulture (Summer),https://abroad.calpoly.edu/index.cfm?FuseAction=Programs.ViewProgram&Program_ID=10896
Cal Poly Exchange with L'Ecole d'Architecture de Paris-Val-de-Seine (CAED),https://abroad.calpoly.edu/index.cfm?FuseAction=Programs.ViewProgram&Program_ID=10005
Cal Poly Exchange with University of Birmingham (CLA & CENG),https://abroad.calpoly.edu/index.cfm?FuseAction=Programs.ViewProgram&Program_ID=10559
Cal Poly Exchange with Lucerne University of Applied Sciences (ENGINEERING),https://abroad.calpoly.edu/index.cfm?FuseAction=Programs.ViewProgram&Program_ID=10020
Cal Poly Global Program_ Cal Poly in Barcelona_ Computational Sciences (Spring),https://abroad.calpoly.edu/index.cfm?FuseAction=Programs.ViewProgram&Program_ID=11312
CSUIP Germany_ Stuttgart Media University,https://abroad.calpoly.edu/index.cfm?FuseAction=Programs.ViewProgram&Program_ID=10785
Cal Poly Exchange with University of Bonn (CHEM AND PHYS),https://abroad.calpoly.edu/index.cfm?FuseAction=Programs.ViewProgram&Program_ID=10902
CSUIP Spain_ Universidad Complutense de Madrid,https://abroad.calpoly.edu/index.cfm?FuseAction=Programs.ViewProgram&Program_ID=10278
"Cal Poly Exchange with Ashesi University (SCIENCE & MATH, ENGINEERING)",https://abroad.calpoly.edu/index.cfm?FuseAction=Programs.ViewProgram&Program_ID=10969
"Cal Poly Global Program_ Cal Poly in Japan & South Korea_ Culture, History & Graphic Novels",https://abroad.calpoly.edu/index.cfm?FuseAction=Programs.ViewProgram&Program_ID=11365
CSUIP Germany_ University of Mannheim,https://abroad.calpoly.edu/index.cfm?FuseAction=Programs.ViewProgram&Program_ID=10254
"Cal Poly Exchange with Chalmers University of Technology, Sweden (CENG)",https://abroad.calpoly.edu/index.cfm?FuseAction=Programs.ViewProgram&Program_ID=10015
Cal Poly Global Program_ Cal Poly in French Polynesia_ Marine Chemistry (Spring course + Summer trav,https://abroad.calpoly.edu/index.cfm?FuseAction=Programs.ViewProgram&Program_ID=11314
Cal Poly Global Program_ Cal Poly in Switzerland & Finland_ Architecture (Summer),https://abroad.calpoly.edu/index.cfm?FuseAction=Programs.ViewProgram&Program_ID=10906
Cal Poly Global Program_ Cal Poly in Prague_ Construction Management (Summer),https://abroad.calpoly.edu/index.cfm?FuseAction=Programs.ViewProgram&Program_ID=10904
Cal Poly Global Program_ Cal Poly in England & Scotland_ Literature (Summer),https://abroad.calpoly.edu/index.cfm?FuseAction=Programs.ViewProgram&Program_ID=11029
Cal Poly Exchange with Hochschule München University of Applied Sciences (Munich) - EXPERIENCE INDUS,https://abroad.calpoly.edu/index.cfm?FuseAction=Programs.ViewProgram&Program_ID=10784
CSUIP South Korea_ Yonsei University,https://abroad.calpoly.edu/index.cfm?FuseAction=Programs.ViewProgram&Program_ID=10270
CSUIP United Kingdom_ University of Bradford,https://abroad.calpoly.edu/index.cfm?FuseAction=Programs.ViewProgram&Program_ID=10556
"Cal Poly Exchange with TECNUN, University of Navarra, Spain (CENG)",https://abroad.calpoly.edu/index.cfm?FuseAction=Programs.ViewProgram&Program_ID=10014
CSUIP Germany_ University of Konstanz,https://abroad.calpoly.edu/index.cfm?FuseAction=Programs.ViewProgram&Program_ID=10972
Cal Poly Global Program_ Cal Poly in London_ Campuswide (Summer),https://abroad.calpoly.edu/index.cfm?FuseAction=Programs.ViewProgram&Program_ID=10889
Cal Poly Global Program_ Cal Poly in Thailand_ Campuswide (Summer),https://abroad.calpoly.edu/index.cfm?FuseAction=Programs.ViewProgram&Program_ID=10891
Cal Poly Global Program_ Cal Poly in Rome_ Mechanics,https://abroad.calpoly.edu/index.cfm?FuseAction=Programs.ViewProgram&Program_ID=10974
CSUIP United Kingdom_ University of Birmingham,https://abroad.calpoly.edu/index.cfm?FuseAction=Programs.ViewProgram&Program_ID=10288
"Cal Poly Exchange with University of Milan, Italy (OCOB)",https://abroad.calpoly.edu/index.cfm?FuseAction=Programs.ViewProgram&Program_ID=10723
Cal Poly Exchange with Hochschule Munchen University of Applied Sciences (Munich) - ARCHITECTURE,https://abroad.calpoly.edu/index.cfm?FuseAction=Programs.ViewProgram&Program_ID=10736
Cal Poly Global Program_ Cal Poly in Rome_ Architecture (Fall),https://abroad.calpoly.edu/index.cfm?FuseAction=Programs.ViewProgram&Program_ID=10908
CSUIP Ghana_ University of Ghana,https://abroad.calpoly.edu/index.cfm?FuseAction=Programs.ViewProgram&Program_ID=10258
CSUIP Japan_ Waseda University,https://abroad.calpoly.edu/index.cfm?FuseAction=Programs.ViewProgram&Program_ID=10269
Cal Poly Exchange with Lucerne University of Applied Sciences (SCIENCE & MATH),https://abroad.calpoly.edu/index.cfm?FuseAction=Programs.ViewProgram&Program_ID=11144
